"No.","Time","Source","Destination","Protocol","Length","Info"
"1","0.000000","52.114.74.44","192.168.43.62","TLSv1.2","481","Application Data"
"2","0.000049","192.168.43.62","52.114.74.44","TCP","54","60962  >  443 [ACK] Seq=1 Ack=428 Win=1018 Len=0"
"3","0.000054","192.168.43.62","52.114.74.44","TCP","54","[TCP Dup ACK 2#1] 60962  >  443 [ACK] Seq=1 Ack=428 Win=1018 Len=0"
"4","0.000995","192.168.43.62","52.114.74.44","TLSv1.2","588","Application Data"
"5","0.001007","192.168.43.62","52.114.74.44","TCP","588","[TCP Retransmission] 60962  >  443 [PSH, ACK] Seq=1 Ack=428 Win=1018 Len=534"
"6","0.001076","192.168.43.62","52.114.74.44","TCP","1414","60962  >  443 [ACK] Seq=535 Ack=428 Win=1018 Len=1360 [TCP segment of a reassembled PDU]"
"7","0.001076","192.168.43.62","52.114.74.44","TLSv1.2","142","Application Data"
"8","0.001082","192.168.43.62","52.114.74.44","TCP","1414","[TCP Out-Of-Order] 60962  >  443 [ACK] Seq=535 Ack=428 Win=1018 Len=1360"
"9","0.001092","192.168.43.62","52.114.74.44","TCP","142","[TCP Retransmission] 60962  >  443 [PSH, ACK] Seq=1895 Ack=428 Win=1018 Len=88"
"10","0.009109","192.168.43.62","52.114.74.44","TCP","66","60963  >  443 [SYN] Seq=0 Win=65535 Len=0 MSS=1460 WS=256 SACK_PERM=1"
"11","0.009114","192.168.43.62","52.114.74.44","TCP","66","[TCP Out-Of-Order] 60963  >  443 [SYN] Seq=0 Win=65535 Len=0 MSS=1460 WS=256 SACK_PERM=1"
"12","0.231027","52.114.74.44","192.168.43.62","TCP","54","443  >  60962 [ACK] Seq=428 Ack=535 Win=1023 Len=0"
"13","0.231125","52.114.74.44","192.168.43.62","TCP","54","443  >  60962 [ACK] Seq=428 Ack=1983 Win=1025 Len=0"
"14","0.318318","52.114.74.44","192.168.43.62","TLSv1.2","481","Application Data"
"15","0.318367","192.168.43.62","52.114.74.44","TCP","54","60962  >  443 [ACK] Seq=1983 Ack=855 Win=1024 Len=0"
"16","0.318373","192.168.43.62","52.114.74.44","TCP","54","[TCP Dup ACK 15#1] 60962  >  443 [ACK] Seq=1983 Ack=855 Win=1024 Len=0"
"17","1.009720","192.168.43.62","52.114.74.44","TCP","66","[TCP Retransmission] 60963  >  443 [SYN] Seq=0 Win=65535 Len=0 MSS=1460 WS=256 SACK_PERM=1"
"18","1.009728","192.168.43.62","52.114.74.44","TCP","66","[TCP Retransmission] 60963  >  443 [SYN] Seq=0 Win=65535 Len=0 MSS=1460 WS=256 SACK_PERM=1"
"19","3.010352","192.168.43.62","52.114.74.44","TCP","66","[TCP Retransmission] 60963  >  443 [SYN] Seq=0 Win=65535 Len=0 MSS=1460 WS=256 SACK_PERM=1"
"20","3.010362","192.168.43.62","52.114.74.44","TCP","66","[TCP Retransmission] 60963  >  443 [SYN] Seq=0 Win=65535 Len=0 MSS=1460 WS=256 SACK_PERM=1"
"21","3.276971","52.114.74.44","192.168.43.62","TCP","66","443  >  60963 [SYN, ACK] Seq=0 Ack=1 Win=8192 Len=0 MSS=1360 WS=256 SACK_PERM=1"
"22","3.277048","192.168.43.62","52.114.74.44","TCP","54","60963  >  443 [ACK] Seq=1 Ack=1 Win=262144 Len=0"
"23","3.277053","192.168.43.62","52.114.74.44","TCP","54","[TCP Dup ACK 22#1] 60963  >  443 [ACK] Seq=1 Ack=1 Win=262144 Len=0"
"24","3.277319","192.168.43.62","52.114.74.44","TLSv1.2","277","Client Hello"
"25","3.277326","192.168.43.62","52.114.74.44","TCP","277","[TCP Retransmission] 60963  >  443 [PSH, ACK] Seq=1 Ack=1 Win=262144 Len=223"
"26","3.511801","52.114.74.44","192.168.43.62","TLSv1.2","195","Server Hello, Change Cipher Spec, Encrypted Handshake Message"
"27","3.511856","192.168.43.62","52.114.74.44","TCP","54","60963  >  443 [ACK] Seq=224 Ack=142 Win=261888 Len=0"
"28","3.511862","192.168.43.62","52.114.74.44","TCP","54","[TCP Dup ACK 27#1] 60963  >  443 [ACK] Seq=224 Ack=142 Win=261888 Len=0"
"29","3.512343","192.168.43.62","52.114.74.44","TLSv1.2","105","Change Cipher Spec, Encrypted Handshake Message"
"30","3.512350","192.168.43.62","52.114.74.44","TCP","105","[TCP Retransmission] 60963  >  443 [PSH, ACK] Seq=224 Ack=142 Win=261888 Len=51"
"31","3.512617","192.168.43.62","52.114.74.44","TLSv1.2","589","Application Data"
"32","3.512622","192.168.43.62","52.114.74.44","TCP","589","[TCP Retransmission] 60963  >  443 [PSH, ACK] Seq=275 Ack=142 Win=261888 Len=535"
"33","3.743702","52.114.74.44","192.168.43.62","TLSv1.2","108","Application Data"
"34","3.743756","192.168.43.62","52.114.74.44","TCP","1414","60963  >  443 [ACK] Seq=810 Ack=196 Win=261888 Len=1360 [TCP segment of a reassembled PDU]"
"35","3.743764","192.168.43.62","52.114.74.44","TCP","1414","[TCP Retransmission] 60963  >  443 [ACK] Seq=810 Ack=196 Win=261888 Len=1360"
"36","4.085779","52.114.74.44","192.168.43.62","TCP","54","443  >  60963 [ACK] Seq=196 Ack=2170 Win=262400 Len=0"
"37","4.085826","192.168.43.62","52.114.74.44","TCP","1414","60963  >  443 [ACK] Seq=2170 Ack=196 Win=261888 Len=1360 [TCP segment of a reassembled PDU]"
"38","4.085826","192.168.43.62","52.114.74.44","TCP","1414","60963  >  443 [ACK] Seq=3530 Ack=196 Win=261888 Len=1360 [TCP segment of a reassembled PDU]"
"39","4.085836","192.168.43.62","52.114.74.44","TCP","1414","[TCP Out-Of-Order] 60963  >  443 [ACK] Seq=2170 Ack=196 Win=261888 Len=1360 [TCP segment of a reassembled PDU]"
"40","4.085849","192.168.43.62","52.114.74.44","TCP","1414","[TCP Retransmission] 60963  >  443 [ACK] Seq=3530 Ack=196 Win=261888 Len=1360"
"44","4.313037","52.114.74.44","192.168.43.62","TCP","54","443  >  60963 [ACK] Seq=196 Ack=4890 Win=262400 Len=0"
"45","4.313084","192.168.43.62","52.114.74.44","TCP","1414","60963  >  443 [ACK] Seq=4890 Ack=196 Win=261888 Len=1360 [TCP segment of a reassembled PDU]"
"46","4.313084","192.168.43.62","52.114.74.44","TCP","1414","60963  >  443 [ACK] Seq=6250 Ack=196 Win=261888 Len=1360 [TCP segment of a reassembled PDU]"
"47","4.313084","192.168.43.62","52.114.74.44","TCP","1414","60963  >  443 [ACK] Seq=7610 Ack=196 Win=261888 Len=1360 [TCP segment of a reassembled PDU]"
"48","4.313084","192.168.43.62","52.114.74.44","TCP","1414","60963  >  443 [ACK] Seq=8970 Ack=196 Win=261888 Len=1360 [TCP segment of a reassembled PDU]"
"49","4.313101","192.168.43.62","52.114.74.44","TCP","1414","[TCP Out-Of-Order] 60963  >  443 [ACK] Seq=4890 Ack=196 Win=261888 Len=1360 [TCP segment of a reassembled PDU]"
"50","4.313114","192.168.43.62","52.114.74.44","TCP","1414","[TCP Out-Of-Order] 60963  >  443 [ACK] Seq=6250 Ack=196 Win=261888 Len=1360 [TCP segment of a reassembled PDU]"
"51","4.313123","192.168.43.62","52.114.74.44","TCP","1414","[TCP Out-Of-Order] 60963  >  443 [ACK] Seq=7610 Ack=196 Win=261888 Len=1360 [TCP segment of a reassembled PDU]"
"52","4.313132","192.168.43.62","52.114.74.44","TCP","1414","[TCP Retransmission] 60963  >  443 [ACK] Seq=8970 Ack=196 Win=261888 Len=1360"
"53","4.546867","52.114.74.44","192.168.43.62","TCP","54","443  >  60963 [ACK] Seq=196 Ack=7610 Win=262400 Len=0"
"54","4.546910","192.168.43.62","52.114.74.44","TCP","1414","60963  >  443 [ACK] Seq=10330 Ack=196 Win=261888 Len=1360 [TCP segment of a reassembled PDU]"
"55","4.546910","192.168.43.62","52.114.74.44","TCP","1414","60963  >  443 [ACK] Seq=11690 Ack=196 Win=261888 Len=1360 [TCP segment of a reassembled PDU]"
"56","4.546910","192.168.43.62","52.114.74.44","TLSv1.2","643","Application Data"
"57","4.546921","192.168.43.62","52.114.74.44","TCP","1414","[TCP Out-Of-Order] 60963  >  443 [ACK] Seq=10330 Ack=196 Win=261888 Len=1360[Reassembly error, protocol TCP: New fragment overlaps old data (retransmission?)]"
"58","4.546931","192.168.43.62","52.114.74.44","TCP","1414","[TCP Out-Of-Order] 60963  >  443 [ACK] Seq=11690 Ack=196 Win=261888 Len=1360[Reassembly error, protocol TCP: New fragment overlaps old data (retransmission?)]"
"59","4.546938","192.168.43.62","52.114.74.44","TCP","643","[TCP Retransmission] 60963  >  443 [PSH, ACK] Seq=13050 Ack=196 Win=261888 Len=589"
"60","4.550438","52.114.74.44","192.168.43.62","TCP","54","443  >  60963 [ACK] Seq=196 Ack=10330 Win=262400 Len=0"
"61","4.781176","52.114.74.44","192.168.43.62","TCP","54","443  >  60963 [ACK] Seq=196 Ack=13050 Win=262400 Len=0"
"62","4.802675","52.114.74.44","192.168.43.62","TLSv1.2","481","Application Data"
"63","4.802731","192.168.43.62","52.114.74.44","TCP","54","60963  >  443 [ACK] Seq=13639 Ack=623 Win=261376 Len=0"
"64","4.802738","192.168.43.62","52.114.74.44","TCP","54","[TCP Dup ACK 63#1] 60963  >  443 [ACK] Seq=13639 Ack=623 Win=261376 Len=0"
"65","4.958487","192.168.43.62","125.39.120.82","TCP","66","60964  >  443 [SYN] Seq=0 Win=65535 Len=0 MSS=1460 WS=2 SACK_PERM=1"
"66","4.958494","192.168.43.62","125.39.120.82","TCP","66","[TCP Out-Of-Order] 60964  >  443 [SYN] Seq=0 Win=65535 Len=0 MSS=1460 WS=2 SACK_PERM=1"
"67","5.958588","192.168.43.62","125.39.120.82","TCP","66","[TCP Retransmission] 60964  >  443 [SYN] Seq=0 Win=65535 Len=0 MSS=1460 WS=2 SACK_PERM=1"
"68","5.958597","192.168.43.62","125.39.120.82","TCP","66","[TCP Retransmission] 60964  >  443 [SYN] Seq=0 Win=65535 Len=0 MSS=1460 WS=2 SACK_PERM=1"
"69","7.958673","192.168.43.62","125.39.120.82","TCP","66","[TCP Retransmission] 60964  >  443 [SYN] Seq=0 Win=65535 Len=0 MSS=1460 WS=2 SACK_PERM=1"
"70","7.958683","192.168.43.62","125.39.120.82","TCP","66","[TCP Retransmission] 60964  >  443 [SYN] Seq=0 Win=65535 Len=0 MSS=1460 WS=2 SACK_PERM=1"
"71","10.013866","192.168.43.62","52.114.74.44","TLSv1.2","588","Application Data"
"72","10.013876","192.168.43.62","52.114.74.44","TCP","588","[TCP Retransmission] 60963  >  443 [PSH, ACK] Seq=13639 Ack=623 Win=261376 Len=534"
"73","10.013978","192.168.43.62","52.114.74.44","TCP","1414","60963  >  443 [ACK] Seq=14173 Ack=623 Win=261376 Len=1360 [TCP segment of a reassembled PDU]"
"74","10.013978","192.168.43.62","52.114.74.44","TCP","1414","60963  >  443 [ACK] Seq=15533 Ack=623 Win=261376 Len=1360 [TCP segment of a reassembled PDU]"
"75","10.013978","192.168.43.62","52.114.74.44","TLSv1.2","127","Application Data"
"76","10.013987","192.168.43.62","52.114.74.44","TCP","1414","[TCP Out-Of-Order] 60963  >  443 [ACK] Seq=14173 Ack=623 Win=261376 Len=1360"
"77","10.013998","192.168.43.62","52.114.74.44","TCP","1414","[TCP Out-Of-Order] 60963  >  443 [ACK] Seq=15533 Ack=623 Win=261376 Len=1360[Reassembly error, protocol TCP: New fragment overlaps old data (retransmission?)]"
"78","10.014005","192.168.43.62","52.114.74.44","TCP","127","[TCP Retransmission] 60963  >  443 [PSH, ACK] Seq=16893 Ack=623 Win=261376 Len=73"
"79","10.255031","52.114.74.44","192.168.43.62","TCP","54","443  >  60963 [ACK] Seq=623 Ack=15533 Win=262400 Len=0"
"80","10.255031","52.114.74.44","192.168.43.62","TCP","54","443  >  60963 [ACK] Seq=623 Ack=16966 Win=262400 Len=0"
"81","10.267338","52.114.74.44","192.168.43.62","TLSv1.2","479","Application Data"
"82","10.267386","192.168.43.62","52.114.74.44","TCP","54","60963  >  443 [ACK] Seq=16966 Ack=1048 Win=260864 Len=0"
"83","10.267391","192.168.43.62","52.114.74.44","TCP","54","[TCP Dup ACK 82#1] 60963  >  443 [ACK] Seq=16966 Ack=1048 Win=260864 Len=0"
"87","11.216672","192.168.43.62","52.187.17.92","TCP","66","60965  >  443 [SYN] Seq=0 Win=64240 Len=0 MSS=1460 WS=256 SACK_PERM=1"
"88","11.216679","192.168.43.62","52.187.17.92","TCP","66","[TCP Out-Of-Order] 60965  >  443 [SYN] Seq=0 Win=64240 Len=0 MSS=1460 WS=256 SACK_PERM=1"
"89","11.284231","52.187.17.92","192.168.43.62","TCP","66","443  >  60965 [SYN, ACK] Seq=0 Ack=1 Win=8192 Len=0 MSS=1360 WS=256 SACK_PERM=1"
"90","11.284316","192.168.43.62","52.187.17.92","TCP","54","60965  >  443 [ACK] Seq=1 Ack=1 Win=66560 Len=0"
"91","11.284322","192.168.43.62","52.187.17.92","TCP","54","[TCP Dup ACK 90#1] 60965  >  443 [ACK] Seq=1 Ack=1 Win=66560 Len=0"
"92","11.284873","192.168.43.62","52.187.17.92","TLSv1.2","251","Client Hello"
"93","11.284880","192.168.43.62","52.187.17.92","TCP","251","[TCP Retransmission] 60965  >  443 [PSH, ACK] Seq=1 Ack=1 Win=66560 Len=197"
"94","11.373367","52.187.17.92","192.168.43.62","TCP","1414","443  >  60965 [ACK] Seq=1 Ack=198 Win=262400 Len=1360 [TCP segment of a reassembled PDU]"
"95","11.373572","52.187.17.92","192.168.43.62","TCP","1414","443  >  60965 [ACK] Seq=1361 Ack=198 Win=262400 Len=1360 [TCP segment of a reassembled PDU]"
"96","11.373602","192.168.43.62","52.187.17.92","TCP","54","60965  >  443 [ACK] Seq=198 Ack=2721 Win=66560 Len=0"
"97","11.373607","192.168.43.62","52.187.17.92","TCP","54","[TCP Dup ACK 96#1] 60965  >  443 [ACK] Seq=198 Ack=2721 Win=66560 Len=0"
"98","11.378072","52.187.17.92","192.168.43.62","TLSv1.2","1130","Server Hello, Certificate, Server Key Exchange, Server Hello Done"
"99","11.380130","192.168.43.62","52.187.17.92","TLSv1.2","147","Client Key Exchange, Change Cipher Spec, Encrypted Handshake Message"
"100","11.380135","192.168.43.62","52.187.17.92","TCP","147","[TCP Retransmission] 60965  >  443 [PSH, ACK] Seq=198 Ack=3797 Win=65536 Len=93"
"101","11.451282","52.187.17.92","192.168.43.62","TLSv1.2","105","Change Cipher Spec, Encrypted Handshake Message"
"102","11.451282","52.187.17.92","192.168.43.62","TLSv1.2","123","Application Data"
"103","11.451338","192.168.43.62","52.187.17.92","TCP","54","60965  >  443 [ACK] Seq=291 Ack=3917 Win=65280 Len=0"
"104","11.451344","192.168.43.62","52.187.17.92","TCP","54","[TCP Dup ACK 103#1] 60965  >  443 [ACK] Seq=291 Ack=3917 Win=65280 Len=0"
"105","11.458964","192.168.43.62","52.187.17.92","TLSv1.2","141","Application Data"
"106","11.458970","192.168.43.62","52.187.17.92","TCP","141","[TCP Retransmission] 60965  >  443 [PSH, ACK] Seq=291 Ack=3917 Win=65280 Len=87"
"107","11.459064","192.168.43.62","52.187.17.92","TLSv1.2","181","Application Data"
"108","11.459068","192.168.43.62","52.187.17.92","TCP","181","[TCP Retransmission] 60965  >  443 [PSH, ACK] Seq=378 Ack=3917 Win=65280 Len=127"
"109","11.459143","192.168.43.62","52.187.17.92","TLSv1.2","92","Application Data"
"110","11.459148","192.168.43.62","52.187.17.92","TCP","92","[TCP Retransmission] 60965  >  443 [PSH, ACK] Seq=505 Ack=3917 Win=65280 Len=38"
"111","11.459210","192.168.43.62","52.187.17.92","TCP","1414","60965  >  443 [ACK] Seq=543 Ack=3917 Win=65280 Len=1360 [TCP segment of a reassembled PDU]"
"112","11.459210","192.168.43.62","52.187.17.92","TCP","1414","60965  >  443 [ACK] Seq=1903 Ack=3917 Win=65280 Len=1360 [TCP segment of a reassembled PDU]"
"113","11.459210","192.168.43.62","52.187.17.92","TCP","1414","60965  >  443 [ACK] Seq=3263 Ack=3917 Win=65280 Len=1360 [TCP segment of a reassembled PDU]"
"114","11.459210","192.168.43.62","52.187.17.92","TLSv1.2","182","Application Data"
"115","11.459220","192.168.43.62","52.187.17.92","TCP","1414","[TCP Out-Of-Order] 60965  >  443 [ACK] Seq=543 Ack=3917 Win=65280 Len=1360"
"116","11.459229","192.168.43.62","52.187.17.92","TCP","1414","[TCP Out-Of-Order] 60965  >  443 [ACK] Seq=1903 Ack=3917 Win=65280 Len=1360[Reassembly error, protocol TCP: New fragment overlaps old data (retransmission?)]"
"117","11.459234","192.168.43.62","52.187.17.92","TCP","1414","[TCP Out-Of-Order] 60965  >  443 [ACK] Seq=3263 Ack=3917 Win=65280 Len=1360[Reassembly error, protocol TCP: New fragment overlaps old data (retransmission?)]"
"118","11.459238","192.168.43.62","52.187.17.92","TCP","182","[TCP Retransmission] 60965  >  443 [PSH, ACK] Seq=4623 Ack=3917 Win=65280 Len=128"
"119","11.536269","52.187.17.92","192.168.43.62","TLSv1.2","92","Application Data"
"120","11.546092","52.187.17.92","192.168.43.62","TCP","54","443  >  60965 [ACK] Seq=3955 Ack=543 Win=261888 Len=0"
"121","11.546198","52.187.17.92","192.168.43.62","TCP","54","443  >  60965 [ACK] Seq=3955 Ack=3263 Win=262400 Len=0"
"122","11.546198","52.187.17.92","192.168.43.62","TCP","54","443  >  60965 [ACK] Seq=3955 Ack=4751 Win=262400 Len=0"
"123","11.547537","52.187.17.92","192.168.43.62","TLSv1.2","109","Application Data"
"124","11.547537","52.187.17.92","192.168.43.62","TLSv1.2","109","Application Data"
"125","11.547593","192.168.43.62","52.187.17.92","TCP","54","60965  >  443 [ACK] Seq=4751 Ack=4065 Win=65280 Len=0"
"126","11.547598","192.168.43.62","52.187.17.92","TCP","54","[TCP Dup ACK 125#1] 60965  >  443 [ACK] Seq=4751 Ack=4065 Win=65280 Len=0"
"127","11.547724","52.187.17.92","192.168.43.62","TLSv1.2","96","Application Data"
"128","11.547759","192.168.43.62","52.187.17.92","TCP","54","60965  >  443 [ACK] Seq=4751 Ack=4107 Win=66560 Len=0"
"129","11.547764","192.168.43.62","52.187.17.92","TCP","54","[TCP Dup ACK 128#1] 60965  >  443 [ACK] Seq=4751 Ack=4107 Win=66560 Len=0"
"130","11.932310","52.187.17.92","192.168.43.62","TLSv1.2","1225","Application Data"
"131","11.959183","192.168.43.62","125.39.120.82","TCP","66","[TCP Retransmission] 60964  >  443 [SYN] Seq=0 Win=65535 Len=0 MSS=1460 WS=2 SACK_PERM=1"
"132","11.959192","192.168.43.62","125.39.120.82","TCP","66","[TCP Retransmission] 60964  >  443 [SYN] Seq=0 Win=65535 Len=0 MSS=1460 WS=2 SACK_PERM=1"
"133","11.973909","192.168.43.62","52.187.17.92","TCP","54","60965  >  443 [ACK] Seq=4751 Ack=5278 Win=65280 Len=0"
"134","11.973916","192.168.43.62","52.187.17.92","TCP","54","[TCP Dup ACK 133#1] 60965  >  443 [ACK] Seq=4751 Ack=5278 Win=65280 Len=0"
"135","20.839596","54.144.197.214","192.168.43.62","TLSv1.2","85","Application Data"
"136","20.839950","192.168.43.62","54.144.197.214","TLSv1.2","89","Application Data"
"137","20.839955","192.168.43.62","54.144.197.214","TCP","89","[TCP Retransmission] 60921  >  443 [PSH, ACK] Seq=1 Ack=32 Win=257 Len=35"
"138","20.845313","192.168.43.62","23.21.104.156","TCP","66","60966  >  443 [SYN] Seq=0 Win=64240 Len=0 MSS=1460 WS=256 SACK_PERM=1"
"139","20.845319","192.168.43.62","23.21.104.156","TCP","66","[TCP Out-Of-Order] 60966  >  443 [SYN] Seq=0 Win=64240 Len=0 MSS=1460 WS=256 SACK_PERM=1"
"140","21.145453","23.21.104.156","192.168.43.62","TCP","58","443  >  60966 [SYN, ACK] Seq=0 Ack=1 Win=26883 Len=0 MSS=1360"
"141","21.145549","192.168.43.62","23.21.104.156","TCP","54","60966  >  443 [ACK] Seq=1 Ack=1 Win=64240 Len=0"
"142","21.145555","192.168.43.62","23.21.104.156","TCP","54","[TCP Dup ACK 141#1] 60966  >  443 [ACK] Seq=1 Ack=1 Win=64240 Len=0"
"143","21.146161","192.168.43.62","23.21.104.156","TLSv1.3","419","Client Hello"
"144","21.146167","192.168.43.62","23.21.104.156","TCP","419","[TCP Retransmission] 60966  >  443 [PSH, ACK] Seq=1 Ack=1 Win=64240 Len=365"
"145","21.157818","54.144.197.214","192.168.43.62","TCP","54","443  >  60921 [ACK] Seq=32 Ack=36 Win=282 Len=0"
"148","21.456119","23.21.104.156","192.168.43.62","TCP","54","443  >  60966 [ACK] Seq=1 Ack=366 Win=26800 Len=0"
"149","21.467678","23.21.104.156","192.168.43.62","TLSv1.3","1354","Server Hello, Change Cipher Spec, Application Data"
"150","21.467926","23.21.104.156","192.168.43.62","TCP","1354","443  >  60966 [ACK] Seq=1301 Ack=366 Win=26800 Len=1300 [TCP segment of a reassembled PDU]"
"151","21.467972","192.168.43.62","23.21.104.156","TCP","54","60966  >  443 [ACK] Seq=366 Ack=2601 Win=65280 Len=0"
"152","21.467979","192.168.43.62","23.21.104.156","TCP","54","[TCP Dup ACK 151#1] 60966  >  443 [ACK] Seq=366 Ack=2601 Win=65280 Len=0"
"153","21.474464","23.21.104.156","192.168.43.62","TCP","1354","443  >  60966 [ACK] Seq=2601 Ack=366 Win=26800 Len=1300 [TCP segment of a reassembled PDU]"
"154","21.474568","23.21.104.156","192.168.43.62","TCP","250","443  >  60966 [PSH, ACK] Seq=3901 Ack=366 Win=26800 Len=196 [TCP segment of a reassembled PDU]"
"155","21.474609","192.168.43.62","23.21.104.156","TCP","54","60966  >  443 [ACK] Seq=366 Ack=4097 Win=65280 Len=0"
"156","21.474615","192.168.43.62","23.21.104.156","TCP","54","[TCP Dup ACK 155#1] 60966  >  443 [ACK] Seq=366 Ack=4097 Win=65280 Len=0"
"157","21.476015","23.21.104.156","192.168.43.62","TLSv1.3","1089","Application Data, Application Data, Application Data"
"158","21.478028","192.168.43.62","23.21.104.156","TLSv1.3","1075","Change Cipher Spec, Application Data, Application Data"
"159","21.478038","192.168.43.62","23.21.104.156","TCP","1075","[TCP Retransmission] 60966  >  443 [PSH, ACK] Seq=366 Ack=5132 Win=64245 Len=1021"
"160","21.786646","192.168.43.62","104.118.163.101","TCP","54","60931  >  443 [FIN, ACK] Seq=1 Ack=1 Win=260 Len=0"
"161","21.786653","192.168.43.62","104.118.163.101","TCP","54","[TCP Out-Of-Order] 60931  >  443 [FIN, ACK] Seq=1 Ack=1 Win=260 Len=0"
"162","21.795767","23.21.104.156","192.168.43.62","TLSv1.3","341","Application Data"
"163","21.795905","23.21.104.156","192.168.43.62","TLSv1.3","341","Application Data"
"164","21.795947","192.168.43.62","23.21.104.156","TCP","54","60966  >  443 [ACK] Seq=1387 Ack=5706 Win=65280 Len=0"
"165","21.795953","192.168.43.62","23.21.104.156","TCP","54","[TCP Dup ACK 164#1] 60966  >  443 [ACK] Seq=1387 Ack=5706 Win=65280 Len=0"
"166","21.835496","23.21.104.156","192.168.43.62","TLSv1.3","307","Application Data"
"167","21.857060","104.118.163.101","192.168.43.62","TCP","54","443  >  60931 [FIN, ACK] Seq=32 Ack=2 Win=245 Len=0"
"168","21.857106","192.168.43.62","104.118.163.101","TCP","54","[TCP Dup ACK 160#1] 60931  >  443 [ACK] Seq=2 Ack=1 Win=260 Len=0"
"169","21.857110","192.168.43.62","104.118.163.101","TCP","54","[TCP Dup ACK 160#2] 60931  >  443 [ACK] Seq=2 Ack=1 Win=260 Len=0"
"170","21.857189","104.118.163.101","192.168.43.62","TLSv1.2","85","[TCP Fast Retransmission] , Encrypted Alert"
"171","21.857225","192.168.43.62","104.118.163.101","TCP","54","60931  >  443 [RST, ACK] Seq=2 Ack=32 Win=0 Len=0"
"172","21.857230","192.168.43.62","104.118.163.101","TCP","54","60931  >  443 [RST, ACK] Seq=2 Ack=32 Win=0 Len=0"
"173","21.876319","192.168.43.62","23.21.104.156","TCP","54","60966  >  443 [ACK] Seq=1387 Ack=5959 Win=65027 Len=0"
"174","21.876326","192.168.43.62","23.21.104.156","TCP","54","[TCP Dup ACK 173#1] 60966  >  443 [ACK] Seq=1387 Ack=5959 Win=65027 Len=0"
"177","22.837807","192.168.43.62","23.21.104.156","TCP","55","[TCP Keep-Alive] 60966  >  443 [ACK] Seq=1386 Ack=5959 Win=65027 Len=1"
"178","22.837815","192.168.43.62","23.21.104.156","TCP","55","[TCP Keep-Alive] 60966  >  443 [ACK] Seq=1386 Ack=5959 Win=65027 Len=1"
"179","23.268106","23.21.104.156","192.168.43.62","TCP","54","[TCP Keep-Alive ACK] 443  >  60966 [ACK] Seq=5959 Ack=1387 Win=28588 Len=0"
"180","24.269124","192.168.43.62","23.21.104.156","TCP","55","[TCP Keep-Alive] 60966  >  443 [ACK] Seq=1386 Ack=5959 Win=65027 Len=1"
"181","24.269132","192.168.43.62","23.21.104.156","TCP","55","[TCP Keep-Alive] 60966  >  443 [ACK] Seq=1386 Ack=5959 Win=65027 Len=1"
"182","24.732730","23.21.104.156","192.168.43.62","TCP","54","[TCP Keep-Alive ACK] 443  >  60966 [ACK] Seq=5959 Ack=1387 Win=28588 Len=0"
"185","25.733399","192.168.43.62","23.21.104.156","TCP","55","[TCP Keep-Alive] 60966  >  443 [ACK] Seq=1386 Ack=5959 Win=65027 Len=1"
"186","25.733407","192.168.43.62","23.21.104.156","TCP","55","[TCP Keep-Alive] 60966  >  443 [ACK] Seq=1386 Ack=5959 Win=65027 Len=1"
"187","26.206008","23.21.104.156","192.168.43.62","TCP","54","[TCP Keep-Alive ACK] 443  >  60966 [ACK] Seq=5959 Ack=1387 Win=28588 Len=0"
"193","27.207463","192.168.43.62","23.21.104.156","TCP","55","[TCP Keep-Alive] 60966  >  443 [ACK] Seq=1386 Ack=5959 Win=65027 Len=1"
"194","27.207470","192.168.43.62","23.21.104.156","TCP","55","[TCP Keep-Alive] 60966  >  443 [ACK] Seq=1386 Ack=5959 Win=65027 Len=1"
"195","27.536442","23.21.104.156","192.168.43.62","TCP","54","[TCP Keep-Alive ACK] 443  >  60966 [ACK] Seq=5959 Ack=1387 Win=28588 Len=0"
"198","28.537296","192.168.43.62","23.21.104.156","TCP","55","[TCP Keep-Alive] 60966  >  443 [ACK] Seq=1386 Ack=5959 Win=65027 Len=1"
"199","28.537305","192.168.43.62","23.21.104.156","TCP","55","[TCP Keep-Alive] 60966  >  443 [ACK] Seq=1386 Ack=5959 Win=65027 Len=1"
"201","28.647618","192.168.43.62","23.219.184.32","TCP","66","60969  >  80 [SYN] Seq=0 Win=64240 Len=0 MSS=1460 WS=256 SACK_PERM=1"
"202","28.647625","192.168.43.62","23.219.184.32","TCP","66","[TCP Out-Of-Order] 60969  >  80 [SYN] Seq=0 Win=64240 Len=0 MSS=1460 WS=256 SACK_PERM=1"
"203","28.699343","23.219.184.32","192.168.43.62","TCP","66","80  >  60969 [SYN, ACK] Seq=0 Ack=1 Win=29200 Len=0 MSS=1360 SACK_PERM=1 WS=128"
"204","28.699427","192.168.43.62","23.219.184.32","TCP","54","60969  >  80 [ACK] Seq=1 Ack=1 Win=66560 Len=0"
"205","28.699436","192.168.43.62","23.219.184.32","TCP","54","[TCP Dup ACK 204#1] 60969  >  80 [ACK] Seq=1 Ack=1 Win=66560 Len=0"
"206","28.699562","192.168.43.62","23.219.184.32","HTTP","341","GET /msdownload/update/v3/static/trustedr/en/disallowedcertstl.cab?98247649f3f63f85 HTTP/1.1 "
"207","28.699568","192.168.43.62","23.219.184.32","TCP","341","[TCP Retransmission] 60969  >  80 [PSH, ACK] Seq=1 Ack=1 Win=66560 Len=287"
"208","28.761753","23.219.184.32","192.168.43.62","TCP","54","80  >  60969 [ACK] Seq=1 Ack=284 Win=30336 Len=0"
"209","28.761847","23.219.184.32","192.168.43.62","TCP","54","80  >  60969 [ACK] Seq=1 Ack=285 Win=30336 Len=0"
"210","28.761847","23.219.184.32","192.168.43.62","TCP","54","80  >  60969 [ACK] Seq=1 Ack=286 Win=30336 Len=0"
"211","28.761971","23.219.184.32","192.168.43.62","TCP","54","80  >  60969 [ACK] Seq=1 Ack=287 Win=30336 Len=0"
"212","28.762100","23.219.184.32","192.168.43.62","TCP","54","80  >  60969 [ACK] Seq=1 Ack=288 Win=30336 Len=0"
"213","28.771652","23.219.184.32","192.168.43.62","HTTP","322","HTTP/1.1 304 Not Modified "
"214","28.780223","192.168.43.62","23.219.184.32","HTTP","336","GET /msdownload/update/v3/static/trustedr/en/pinrulesstl.cab?a901ab1453d8e97e HTTP/1.1 "
"215","28.780232","192.168.43.62","23.219.184.32","TCP","336","[TCP Retransmission] 60969  >  80 [PSH, ACK] Seq=288 Ack=269 Win=66304 Len=282"
"216","28.847603","23.219.184.32","192.168.43.62","HTTP","325","HTTP/1.1 304 Not Modified "
"217","28.860594","23.21.104.156","192.168.43.62","TCP","54","[TCP Keep-Alive ACK] 443  >  60966 [ACK] Seq=5959 Ack=1387 Win=28588 Len=0"
"218","28.887623","192.168.43.62","23.219.184.32","TCP","54","60969  >  80 [ACK] Seq=570 Ack=540 Win=66048 Len=0"
"219","28.887631","192.168.43.62","23.219.184.32","TCP","54","[TCP Dup ACK 218#1] 60969  >  80 [ACK] Seq=570 Ack=540 Win=66048 Len=0"
"220","28.965251","192.168.43.62","40.90.189.152","TLSv1.2","153","Application Data"
"221","28.965259","192.168.43.62","40.90.189.152","TCP","153","[TCP Retransmission] 58487  >  443 [PSH, ACK] Seq=1 Ack=1 Win=258 Len=99"
"222","29.038451","40.90.189.152","192.168.43.62","TLSv1.2","223","Application Data"
"223","29.053959","13.107.42.12","192.168.43.62","TCP","54","443  >  60934 [RST, ACK] Seq=1 Ack=1 Win=0 Len=0"
"224","29.079522","192.168.43.62","40.90.189.152","TCP","54","58487  >  443 [ACK] Seq=100 Ack=170 Win=257 Len=0"
"225","29.079529","192.168.43.62","40.90.189.152","TCP","54","[TCP Dup ACK 224#1] 58487  >  443 [ACK] Seq=100 Ack=170 Win=257 Len=0"
"228","29.861491","192.168.43.62","23.21.104.156","TCP","55","[TCP Keep-Alive] 60966  >  443 [ACK] Seq=1386 Ack=5959 Win=65027 Len=1"
"229","29.861499","192.168.43.62","23.21.104.156","TCP","55","[TCP Keep-Alive] 60966  >  443 [ACK] Seq=1386 Ack=5959 Win=65027 Len=1"
"230","30.233639","23.21.104.156","192.168.43.62","TCP","54","[TCP Keep-Alive ACK] 443  >  60966 [ACK] Seq=5959 Ack=1387 Win=28588 Len=0"
"231","31.233972","192.168.43.62","23.21.104.156","TCP","55","[TCP Keep-Alive] 60966  >  443 [ACK] Seq=1386 Ack=5959 Win=65027 Len=1"
"232","31.233978","192.168.43.62","23.21.104.156","TCP","55","[TCP Keep-Alive] 60966  >  443 [ACK] Seq=1386 Ack=5959 Win=65027 Len=1"
"233","31.655836","23.21.104.156","192.168.43.62","TCP","54","[TCP Keep-Alive ACK] 443  >  60966 [ACK] Seq=5959 Ack=1387 Win=28588 Len=0"
"234","32.656290","192.168.43.62","23.21.104.156","TCP","55","[TCP Keep-Alive] 60966  >  443 [ACK] Seq=1386 Ack=5959 Win=65027 Len=1"
"235","32.656297","192.168.43.62","23.21.104.156","TCP","55","[TCP Keep-Alive] 60966  >  443 [ACK] Seq=1386 Ack=5959 Win=65027 Len=1"
"238","33.152596","23.21.104.156","192.168.43.62","TCP","54","[TCP Keep-Alive ACK] 443  >  60966 [ACK] Seq=5959 Ack=1387 Win=28588 Len=0"
"239","34.152873","192.168.43.62","23.21.104.156","TCP","55","[TCP Keep-Alive] 60966  >  443 [ACK] Seq=1386 Ack=5959 Win=65027 Len=1"
"240","34.152880","192.168.43.62","23.21.104.156","TCP","55","[TCP Keep-Alive] 60966  >  443 [ACK] Seq=1386 Ack=5959 Win=65027 Len=1"
"243","34.478579","23.21.104.156","192.168.43.62","TCP","54","[TCP Keep-Alive ACK] 443  >  60966 [ACK] Seq=5959 Ack=1387 Win=28588 Len=0"
"246","35.487147","192.168.43.62","23.21.104.156","TCP","55","[TCP Keep-Alive] 60966  >  443 [ACK] Seq=1386 Ack=5959 Win=65027 Len=1"
"247","35.487154","192.168.43.62","23.21.104.156","TCP","55","[TCP Keep-Alive] 60966  >  443 [ACK] Seq=1386 Ack=5959 Win=65027 Len=1"
"248","35.807936","23.21.104.156","192.168.43.62","TCP","54","[TCP Keep-Alive ACK] 443  >  60966 [ACK] Seq=5959 Ack=1387 Win=28588 Len=0"
"251","36.807983","192.168.43.62","23.21.104.156","TCP","55","[TCP Keep-Alive] 60966  >  443 [ACK] Seq=1386 Ack=5959 Win=65027 Len=1"
"252","36.807991","192.168.43.62","23.21.104.156","TCP","55","[TCP Keep-Alive] 60966  >  443 [ACK] Seq=1386 Ack=5959 Win=65027 Len=1"
"253","36.837018","192.168.43.62","23.21.104.156","TCP","54","60966  >  443 [FIN, ACK] Seq=1387 Ack=5959 Win=65027 Len=0"
"254","36.837027","192.168.43.62","23.21.104.156","TCP","54","[TCP Out-Of-Order] 60966  >  443 [FIN, ACK] Seq=1387 Ack=5959 Win=65027 Len=0"
"255","37.140601","23.21.104.156","192.168.43.62","TCP","54","[TCP Dup ACK 162#1] 443  >  60966 [ACK] Seq=5959 Ack=1387 Win=28588 Len=0"
"256","37.157776","23.21.104.156","192.168.43.62","TCP","54","443  >  60966 [FIN, ACK] Seq=5959 Ack=1388 Win=28588 Len=0"
"257","37.157829","192.168.43.62","23.21.104.156","TCP","54","60966  >  443 [ACK] Seq=1388 Ack=5960 Win=65027 Len=0"
"258","37.157834","192.168.43.62","23.21.104.156","TCP","54","[TCP Dup ACK 257#1] 60966  >  443 [ACK] Seq=1388 Ack=5960 Win=65027 Len=0"
"259","37.361579","192.168.43.62","52.187.17.92","TLSv1.2","105","Application Data"
"260","37.361587","192.168.43.62","52.187.17.92","TCP","105","[TCP Retransmission] 60965  >  443 [PSH, ACK] Seq=4751 Ack=5278 Win=65280 Len=51"
"261","37.361730","192.168.43.62","52.187.17.92","TCP","1414","60965  >  443 [ACK] Seq=4802 Ack=5278 Win=65280 Len=1360 [TCP segment of a reassembled PDU]"
"262","37.361730","192.168.43.62","52.187.17.92","TCP","1414","60965  >  443 [ACK] Seq=6162 Ack=5278 Win=65280 Len=1360 [TCP segment of a reassembled PDU]"
"263","37.361730","192.168.43.62","52.187.17.92","TCP","1414","60965  >  443 [ACK] Seq=7522 Ack=5278 Win=65280 Len=1360 [TCP segment of a reassembled PDU]"
"264","37.361730","192.168.43.62","52.187.17.92","TCP","1414","60965  >  443 [ACK] Seq=8882 Ack=5278 Win=65280 Len=1360 [TCP segment of a reassembled PDU]"
"265","37.361730","192.168.43.62","52.187.17.92","TLSv1.2","956","Application Data"
"266","37.361744","192.168.43.62","52.187.17.92","TCP","1414","[TCP Out-Of-Order] 60965  >  443 [ACK] Seq=4802 Ack=5278 Win=65280 Len=1360"
"267","37.361759","192.168.43.62","52.187.17.92","TCP","1414","[TCP Out-Of-Order] 60965  >  443 [ACK] Seq=6162 Ack=5278 Win=65280 Len=1360[Reassembly error, protocol TCP: New fragment overlaps old data (retransmission?)]"
"268","37.361766","192.168.43.62","52.187.17.92","TCP","1414","[TCP Out-Of-Order] 60965  >  443 [ACK] Seq=7522 Ack=5278 Win=65280 Len=1360[Reassembly error, protocol TCP: New fragment overlaps old data (retransmission?)]"
"269","37.361772","192.168.43.62","52.187.17.92","TCP","1414","[TCP Out-Of-Order] 60965  >  443 [ACK] Seq=8882 Ack=5278 Win=65280 Len=1360[Reassembly error, protocol TCP: New fragment overlaps old data (retransmission?)]"
"270","37.361777","192.168.43.62","52.187.17.92","TCP","956","[TCP Retransmission] 60965  >  443 [PSH, ACK] Seq=10242 Ack=5278 Win=65280 Len=902"
"271","37.451697","52.187.17.92","192.168.43.62","TCP","54","443  >  60965 [ACK] Seq=5278 Ack=6162 Win=262400 Len=0"
"272","37.463162","52.187.17.92","192.168.43.62","TCP","54","443  >  60965 [ACK] Seq=5278 Ack=8882 Win=262400 Len=0"
"273","37.463213","52.187.17.92","192.168.43.62","TCP","54","443  >  60965 [ACK] Seq=5278 Ack=11144 Win=262400 Len=0"
"274","37.463213","52.187.17.92","192.168.43.62","TLSv1.2","109","Application Data"
"275","37.465930","52.187.17.92","192.168.43.62","TLSv1.2","109","Application Data"
"276","37.465930","52.187.17.92","192.168.43.62","TLSv1.2","109","Application Data"
"277","37.466069","192.168.43.62","52.187.17.92","TCP","54","60965  >  443 [ACK] Seq=11144 Ack=5443 Win=65280 Len=0"
"278","37.466085","192.168.43.62","52.187.17.92","TCP","54","[TCP Dup ACK 277#1] 60965  >  443 [ACK] Seq=11144 Ack=5443 Win=65280 Len=0"
"279","37.467611","52.187.17.92","192.168.43.62","TLSv1.2","96","Application Data"
"280","37.467662","192.168.43.62","52.187.17.92","TCP","54","60965  >  443 [ACK] Seq=11144 Ack=5485 Win=66560 Len=0"
"281","37.467669","192.168.43.62","52.187.17.92","TCP","54","[TCP Dup ACK 280#1] 60965  >  443 [ACK] Seq=11144 Ack=5485 Win=66560 Len=0"
"282","37.626349","52.187.17.92","192.168.43.62","TLSv1.2","398","Application Data"
"283","37.666921","192.168.43.62","52.187.17.92","TCP","54","60965  >  443 [ACK] Seq=11144 Ack=5829 Win=66048 Len=0"
"284","37.666929","192.168.43.62","52.187.17.92","TCP","54","[TCP Dup ACK 283#1] 60965  >  443 [ACK] Seq=11144 Ack=5829 Win=66048 Len=0"
"366","52.667280","192.168.43.62","58.251.106.185","TCP","66","60975  >  443 [SYN] Seq=0 Win=65535 Len=0 MSS=1460 WS=2 SACK_PERM=1"
"367","52.667287","192.168.43.62","58.251.106.185","TCP","66","[TCP Out-Of-Order] 60975  >  443 [SYN] Seq=0 Win=65535 Len=0 MSS=1460 WS=2 SACK_PERM=1"
"368","53.113427","58.251.106.185","192.168.43.62","TCP","66","443  >  60975 [SYN, ACK] Seq=0 Ack=1 Win=13600 Len=0 MSS=1360 SACK_PERM=1 WS=1024"
"369","53.113531","192.168.43.62","58.251.106.185","TCP","54","60975  >  443 [ACK] Seq=1 Ack=1 Win=65536 Len=0"
"370","53.113540","192.168.43.62","58.251.106.185","TCP","54","[TCP Dup ACK 369#1] 60975  >  443 [ACK] Seq=1 Ack=1 Win=65536 Len=0"
"371","53.113610","192.168.43.62","58.251.106.185","TCP","400","60975  >  443 [PSH, ACK] Seq=1 Ack=1 Win=65536 Len=346 [TCP segment of a reassembled PDU]"
"372","53.113618","192.168.43.62","58.251.106.185","TCP","400","[TCP Retransmission] 60975  >  443 [PSH, ACK] Seq=1 Ack=1 Win=65536 Len=346"
"373","53.581179","58.251.106.185","192.168.43.62","TCP","54","443  >  60975 [ACK] Seq=1 Ack=347 Win=15360 Len=0"
"374","53.581308","58.251.106.185","192.168.43.62","TCP","74","443  >  60975 [PSH, ACK] Seq=1 Ack=347 Win=15360 Len=20 [TCP segment of a reassembled PDU]"
"375","53.621604","192.168.43.62","58.251.106.185","TCP","54","60975  >  443 [ACK] Seq=347 Ack=21 Win=65516 Len=0"
"376","53.621612","192.168.43.62","58.251.106.185","TCP","54","[TCP Dup ACK 375#1] 60975  >  443 [ACK] Seq=347 Ack=21 Win=65516 Len=0"
"379","54.783167","192.168.43.62","58.251.106.185","TCP","54","60975  >  443 [FIN, ACK] Seq=347 Ack=21 Win=65516 Len=0"
"380","54.783174","192.168.43.62","58.251.106.185","TCP","54","[TCP Out-Of-Order] 60975  >  443 [FIN, ACK] Seq=347 Ack=21 Win=65516 Len=0"
"381","55.001856","52.113.194.132","192.168.43.62","TCP","54","443  >  60958 [RST, ACK] Seq=1 Ack=1 Win=0 Len=0"
"400","55.103141","192.168.43.62","203.205.219.54","TCP","66","60976  >  80 [SYN] Seq=0 Win=64240 Len=0 MSS=1460 WS=256 SACK_PERM=1"
"401","55.103146","192.168.43.62","203.205.219.54","TCP","66","[TCP Out-Of-Order] 60976  >  80 [SYN] Seq=0 Win=64240 Len=0 MSS=1460 WS=256 SACK_PERM=1"
"404","55.156025","192.168.43.62","203.205.253.140","TCP","66","60977  >  80 [SYN] Seq=0 Win=64240 Len=0 MSS=1460 WS=256 SACK_PERM=1"
"405","55.156030","192.168.43.62","203.205.253.140","TCP","66","[TCP Out-Of-Order] 60977  >  80 [SYN] Seq=0 Win=64240 Len=0 MSS=1460 WS=256 SACK_PERM=1"
"410","55.200895","192.168.43.62","203.205.219.54","TCP","66","60978  >  80 [SYN] Seq=0 Win=64240 Len=0 MSS=1460 WS=256 SACK_PERM=1"
"411","55.200902","192.168.43.62","203.205.219.54","TCP","66","[TCP Out-Of-Order] 60978  >  80 [SYN] Seq=0 Win=64240 Len=0 MSS=1460 WS=256 SACK_PERM=1"
"412","55.209663","203.205.219.54","192.168.43.62","TCP","66","80  >  60976 [SYN, ACK] Seq=0 Ack=1 Win=13600 Len=0 MSS=1360 SACK_PERM=1 WS=1024"
"413","55.209762","192.168.43.62","203.205.219.54","TCP","54","60976  >  80 [ACK] Seq=1 Ack=1 Win=66560 Len=0"
"414","55.209768","192.168.43.62","203.205.219.54","TCP","54","[TCP Dup ACK 413#1] 60976  >  80 [ACK] Seq=1 Ack=1 Win=66560 Len=0"
"415","55.211169","192.168.43.62","203.205.219.54","TCP","374","60976  >  80 [PSH, ACK] Seq=1 Ack=1 Win=66560 Len=320 [TCP segment of a reassembled PDU]"
"416","55.211176","192.168.43.62","203.205.219.54","TCP","374","[TCP Retransmission] 60976  >  80 [PSH, ACK] Seq=1 Ack=1 Win=66560 Len=320"
"417","55.211288","192.168.43.62","203.205.219.54","TCP","1414","60976  >  80 [ACK] Seq=321 Ack=1 Win=66560 Len=1360 [TCP segment of a reassembled PDU]"
"418","55.211288","192.168.43.62","203.205.219.54","HTTP","148","POST / HTTP/1.1  (application/x-www-form-urlencoded)"
"419","55.211306","192.168.43.62","203.205.219.54","TCP","1414","[TCP Out-Of-Order] 60976  >  80 [ACK] Seq=321 Ack=1 Win=66560 Len=1360[Reassembly error, protocol TCP: New fragment overlaps old data (retransmission?)]"
"420","55.211322","192.168.43.62","203.205.219.54","TCP","148","[TCP Retransmission] 60976  >  80 [PSH, ACK] Seq=1681 Ack=1 Win=66560 Len=94"
"423","55.264519","203.205.253.140","192.168.43.62","TCP","66","80  >  60977 [SYN, ACK] Seq=0 Ack=1 Win=13600 Len=0 MSS=1360 SACK_PERM=1 WS=1024"
"424","55.264627","192.168.43.62","203.205.253.140","TCP","54","60977  >  80 [ACK] Seq=1 Ack=1 Win=66560 Len=0"
"425","55.264636","192.168.43.62","203.205.253.140","TCP","54","[TCP Dup ACK 424#1] 60977  >  80 [ACK] Seq=1 Ack=1 Win=66560 Len=0"
"426","55.264773","192.168.43.62","203.205.253.140","HTTP","168","GET /downloads/xml/ConfigFileInfo.xml HTTP/1.1 "
"427","55.264781","192.168.43.62","203.205.253.140","TCP","168","[TCP Retransmission] 60977  >  80 [PSH, ACK] Seq=1 Ack=1 Win=66560 Len=114"
"431","55.316602","203.205.219.54","192.168.43.62","TCP","66","80  >  60978 [SYN, ACK] Seq=0 Ack=1 Win=13600 Len=0 MSS=1360 SACK_PERM=1 WS=1024"
"432","55.316695","192.168.43.62","203.205.219.54","TCP","54","60978  >  80 [ACK] Seq=1 Ack=1 Win=66560 Len=0"
"433","55.316701","192.168.43.62","203.205.219.54","TCP","54","[TCP Dup ACK 432#1] 60978  >  80 [ACK] Seq=1 Ack=1 Win=66560 Len=0"
"434","55.322403","203.205.219.54","192.168.43.62","TCP","54","80  >  60976 [ACK] Seq=1 Ack=317 Win=15360 Len=0"
"435","55.322403","203.205.219.54","192.168.43.62","TCP","54","80  >  60976 [ACK] Seq=1 Ack=318 Win=15360 Len=0"
"436","55.322509","203.205.219.54","192.168.43.62","TCP","54","80  >  60976 [ACK] Seq=1 Ack=319 Win=15360 Len=0"
"437","55.322509","203.205.219.54","192.168.43.62","TCP","54","80  >  60976 [ACK] Seq=1 Ack=320 Win=15360 Len=0"
"438","55.323815","203.205.219.54","192.168.43.62","TCP","54","80  >  60976 [ACK] Seq=1 Ack=321 Win=15360 Len=0"
"439","55.323815","203.205.219.54","192.168.43.62","TCP","54","80  >  60976 [ACK] Seq=1 Ack=1677 Win=17408 Len=0"
"440","55.323910","203.205.219.54","192.168.43.62","TCP","54","80  >  60976 [ACK] Seq=1 Ack=1678 Win=17408 Len=0"
"441","55.323965","203.205.219.54","192.168.43.62","TCP","54","80  >  60976 [ACK] Seq=1 Ack=1679 Win=17408 Len=0"
"442","55.324100","203.205.219.54","192.168.43.62","TCP","54","80  >  60976 [ACK] Seq=1 Ack=1680 Win=17408 Len=0"
"443","55.330143","203.205.219.54","192.168.43.62","TCP","54","80  >  60976 [ACK] Seq=1 Ack=1681 Win=17408 Len=0"
"444","55.330143","203.205.219.54","192.168.43.62","TCP","54","80  >  60976 [ACK] Seq=1 Ack=1771 Win=17408 Len=0"
"445","55.330143","203.205.219.54","192.168.43.62","TCP","54","80  >  60976 [ACK] Seq=1 Ack=1772 Win=17408 Len=0"
"446","55.330303","203.205.219.54","192.168.43.62","TCP","54","80  >  60976 [ACK] Seq=1 Ack=1773 Win=17408 Len=0"
"447","55.330303","203.205.219.54","192.168.43.62","TCP","54","80  >  60976 [ACK] Seq=1 Ack=1774 Win=17408 Len=0"
"448","55.330390","203.205.219.54","192.168.43.62","TCP","54","80  >  60976 [ACK] Seq=1 Ack=1775 Win=17408 Len=0"
